{
  "schema_version": 1,
  "host_id": "lab-global-primary",
  "kind": "service",
  "observed_at": "2026-09-10T00:00:00Z",
  "last_success_at": "2026-09-10T00:00:00Z",
  "source": {"kind": "file", "origin": "fixtures/observation.json", "version": null, "digest": "aaaaaaaaaaaaaaaaaaaaaaaaaaaaaaaaaaaaaaaaaaaaaaaaaaaaaaaaaaaaaaaa"},
  "quality": "fresh",
  "data": {"service_state": "paused", "summary": "service pause is distinct from host lifecycle"},
  "error": null
}
